{
  "schema_version": "2.0",
  "catalog_version": "phase-9-final",
  "description": "insert_me mutation strategy catalog. Each entry describes one CWE family, its current implementation maturity, Juliet-derived rationale, and planning-layer suitability metadata.",
  "maturity_levels": {
    "IMPLEMENTED_AND_CORPUS_ADMITTED": "Implemented in patcher.py, has sandbox seeds, quality gate pass rate >= 80%, reproducibility 100%, corpus-admitted. Suitable for planning layer.",
    "IMPLEMENTED_EXPERIMENTAL": "Implemented in patcher.py with unit tests, but not corpus-admitted: insufficient sandbox coverage or quality gate not yet run. Planning layer uses with reduced confidence.",
    "PARTIAL": "Prototype exists but quality gate pass rate < 80%.",
    "PLANNED": "Design documented; multi-line handler infrastructure available; implementation is next-priority.",
    "CANDIDATE": "Feasibility assessed; no design or implementation yet.",
    "DISABLED": "Was implemented; disabled due to quality issues."
  },
  "strategies": [
    {
      "strategy_id": "alloc_size_undercount",
      "cwe_id": "CWE-122",
      "cwe_name": "Heap-based Buffer Overflow",
      "vulnerability_class": "Memory Safety -- Spatial",
      "maturity": "IMPLEMENTED_AND_CORPUS_ADMITTED",
      "pattern_type": "malloc_call",
      "suitable_for_planning": true,
      "description": "Transforms malloc(<expr>) to malloc((<expr>) - 1). Introduces a one-byte undercount in a heap allocation. When the caller writes the expected number of bytes, the write overflows the allocated region.",
      "juliet_rationale": "Mirrors Juliet CWE122 patterns: allocate a buffer, write exactly N bytes. Off-by-one in allocation size is the canonical buffer-overflow insertion.",
      "source_pattern": "malloc(<arithmetic-expr>) -- prefer lines with n * sizeof(T) or similar arithmetic",
      "sink_pattern": "memcpy / strcpy / field-write using the allocated pointer",
      "juliet_coverage": "CWE122_Heap_Based_Buffer_Overflow__c_CWE129_*",
      "deterministic": true,
      "quality_gate_pass_rate": 1.0,
      "corpus_cases": 34,
      "common_failure_modes": [
        "malloc(sizeof(T)) without arithmetic -- mutation is syntactically valid but semantically trivial",
        "malloc result unused -- NOOP audit if pointer not written through"
      ],
      "notes": "Most reliable strategy. Scores 0.75 in quality gate (arithmetic-expression malloc lines)."
    },
    {
      "strategy_id": "insert_premature_free",
      "cwe_id": "CWE-416",
      "cwe_name": "Use After Free",
      "vulnerability_class": "Memory Safety -- Temporal",
      "maturity": "IMPLEMENTED_AND_CORPUS_ADMITTED",
      "pattern_type": "pointer_deref",
      "suitable_for_planning": true,
      "description": "Inserts free(<ptr>); immediately before a pointer dereference (ptr->field or *ptr). The freed pointer is then used on the very next line, producing a use-after-free.",
      "juliet_rationale": "Mirrors Juliet CWE416 patterns: allocate, use, then a free followed immediately by another use of the same pointer.",
      "source_pattern": "ptr->field or *ptr dereference -- prefer lines where ptr was malloc'd within the same function scope",
      "sink_pattern": "Any write or read through the freed pointer on the immediately following line",
      "juliet_coverage": "CWE416_Use_After_Free__*",
      "deterministic": true,
      "quality_gate_pass_rate": 1.0,
      "corpus_cases": 24,
      "common_failure_modes": [
        "Loop-body dereference: free inside a loop causes repeated free on second iteration (secondary flaw)",
        "Sub-malloc: free before malloc(ptr->field) creates a double-use issue"
      ],
      "notes": "Reliable strategy with multi-signal scoring (prior malloc in scope, loop-body and conditional-guard penalties, sub-malloc penalty)."
    },
    {
      "strategy_id": "insert_double_free",
      "cwe_id": "CWE-415",
      "cwe_name": "Double Free",
      "vulnerability_class": "Memory Safety -- Temporal",
      "maturity": "IMPLEMENTED_AND_CORPUS_ADMITTED",
      "pattern_type": "free_call",
      "suitable_for_planning": true,
      "description": "Inserts a duplicate free(<ptr>); immediately before an existing free() call. The heap allocator receives two calls to free the same pointer, which is undefined behaviour and exploitable on most platforms.",
      "juliet_rationale": "Mirrors Juliet CWE415 patterns: allocate, free, free again. Duplicate free is the canonical double-free pattern.",
      "source_pattern": "free(<simple-ptr>) or free(ptr->field) -- prefer non-loop, non-guard-expression locations",
      "sink_pattern": "The existing free() call that the duplicate is inserted before",
      "juliet_coverage": "CWE415_Double_Free__*",
      "deterministic": true,
      "quality_gate_pass_rate": 0.9,
      "corpus_cases": 13,
      "common_failure_modes": [
        "free() inside a loop: inserting a duplicate causes the loop-body double-free on every iteration",
        "free() in conditional guard: inserting before error-handling free may create unreachable double-free"
      ],
      "notes": "Works on any simple free(ptr) or free(ptr->field). Quality gate ~90%."
    },
    {
      "strategy_id": "remove_free_call",
      "cwe_id": "CWE-401",
      "cwe_name": "Missing Release of Memory after Effective Lifetime",
      "vulnerability_class": "Resource Management -- Memory Leak",
      "maturity": "IMPLEMENTED_AND_CORPUS_ADMITTED",
      "pattern_type": "free_call",
      "suitable_for_planning": true,
      "description": "Replaces a free(<ptr>); call with a comment /* CWE-401: free(ptr) removed - memory leak */. The heap-allocated object is never released, causing a memory leak.",
      "juliet_rationale": "Mirrors Juliet CWE401 patterns: allocate memory, forget to free it. Removing the free() call is the minimal-mutation equivalent.",
      "source_pattern": "free(<simple-ptr>) -- same as insert_double_free but the mutation removes rather than duplicates",
      "sink_pattern": "End of function scope or error-return path where the allocation is no longer reachable",
      "juliet_coverage": "CWE401_Memory_Leak__*",
      "deterministic": true,
      "quality_gate_pass_rate": 0.9,
      "corpus_cases": 13,
      "common_failure_modes": [
        "Detector may only report low-severity leak warning -- semantic matching needed for evaluation"
      ],
      "notes": "Simple and reliable. Quality gate ~90%."
    },
    {
      "strategy_id": "remove_null_guard",
      "cwe_id": "CWE-476",
      "cwe_name": "NULL Pointer Dereference",
      "vulnerability_class": "Memory Safety -- Null Dereference",
      "maturity": "IMPLEMENTED_AND_CORPUS_ADMITTED",
      "pattern_type": "null_guard",
      "suitable_for_planning": true,
      "description": "Replaces a null-check guard (if (!ptr) return; or multiline form) with a comment, leaving a NULL dereference reachable at the subsequent ptr->field line. Dual-mode handler supports both inline and multiline guard forms.",
      "juliet_rationale": "Mirrors Juliet CWE476 patterns: null pointer dereference after a guard that protects a subsequent pointer use.",
      "source_pattern": "if (!ptr) return; (inline) or if (!ptr)\\n    return NULL; (multiline) immediately before a ptr->field dereference",
      "sink_pattern": "ptr->field or *ptr on the line following the removed guard (guard head and body lines both blanked for multiline form)",
      "juliet_coverage": "CWE476_NULL_Pointer_Dereference__*",
      "deterministic": true,
      "quality_gate_pass_rate": 1.0,
      "corpus_cases": 8,
      "common_failure_modes": [
        "Guard followed by function call rather than pointer dereference -- patcher correctly returns NOOP",
        "Guard followed by abort() rather than return -- body not classified as return/break/continue, scan fails"
      ],
      "notes": "Corpus-admitted in Phase 10. Dual-mode handler: primary mode targets guard lines (Seeder null_guard pattern); backward-compat mode targets deref lines. 8 sandbox seeds, 8/8 VALID quality gate."
    },
    {
      "strategy_id": null,
      "cwe_id": "CWE-190",
      "cwe_name": "Integer Overflow or Wraparound",
      "vulnerability_class": "Numeric Error",
      "maturity": "PLANNED",
      "pattern_type": "malloc_call",
      "suitable_for_planning": false,
      "description": "Remove the overflow check (e.g., if (n > MAX) return;) that precedes a multiplication-based malloc(n * sizeof(T)). The resulting allocation is undersized when n overflows.",
      "juliet_rationale": "Mirrors Juliet CWE190 patterns: integer arithmetic overflows feeding a size calculation.",
      "source_pattern": "malloc(n * sizeof(T)) with a preceding guard like if (n > MAX) return;",
      "sink_pattern": "The malloc call itself, when the guard is removed and n can wrap",
      "juliet_coverage": "CWE190_Integer_Overflow__*",
      "deterministic": true,
      "quality_gate_pass_rate": null,
      "corpus_cases": 0,
      "notes": "Multi-line blocker resolved (handler infrastructure in place). Implementation follows remove_null_guard pattern."
    },
    {
      "strategy_id": null,
      "cwe_id": "CWE-787",
      "cwe_name": "Out-of-bounds Write",
      "vulnerability_class": "Memory Safety -- Spatial",
      "maturity": "PLANNED",
      "pattern_type": "malloc_call",
      "suitable_for_planning": false,
      "description": "Reduce the size of a heap allocation feeding a memcpy/strcpy so the write exceeds the allocated region.",
      "juliet_rationale": "Mirrors Juliet CWE787 patterns: write to a heap buffer whose size was calculated incorrectly.",
      "source_pattern": "malloc(<size-expr>) where size-expr matches the destination argument of a subsequent memcpy/strcpy",
      "sink_pattern": "memcpy/strcpy call writing more bytes than the (now undersized) allocation",
      "juliet_coverage": "CWE787_Write_What_Where_Condition__*",
      "deterministic": true,